{
  "$schema": "https://json-schema.org/draft/2020-12/schema",
  "$id": "https://orbanplatform.com/agent-harness/schemas/0.2/template.schema.json",
  "title": "Agent Harness Profile 0.2 template manifest (template.json)",
  "description": "Manifest of a template bundle. Lists every file of the bundle with its role, the standard it follows and the SHA-256 digest of its exact bytes. Profile: https://orbanplatform.com/agent-harness/0.2. Requirement levels in property descriptions follow the profile: Required, Conditionally Required, Recommended, Opt-In.",
  "type": "object",
  "additionalProperties": false,
  "required": ["profile", "profile_version", "id", "title", "summary", "locale", "files", "provenance"],
  "properties": {
    "$schema": {
      "description": "Recommended. URI of this JSON Schema. When present it MUST be exactly this schema's $id.",
      "const": "https://orbanplatform.com/agent-harness/schemas/0.2/template.schema.json"
    },
    "profile": {
      "description": "Required. Profile identifier. MUST be https://orbanplatform.com/agent-harness/0.2.",
      "const": "https://orbanplatform.com/agent-harness/0.2"
    },
    "profile_version": {
      "description": "Required. Profile version (semver) the bundle was written against. MUST be 0.1.0.",
      "const": "0.2.0"
    },
    "id": {
      "description": "Required. Template identifier: lowercase letters, digits and hyphens, 2 to 63 characters, starting with a letter or digit.",
      "type": "string",
      "pattern": "^[a-z0-9][a-z0-9-]{1,62}$"
    },
    "title": {
      "description": "Required. Short human-readable title of the template.",
      "type": "string",
      "minLength": 1,
      "maxLength": 200
    },
    "summary": {
      "description": "Required. Plain-language summary of the agent's job, at most 500 characters.",
      "type": "string",
      "minLength": 1,
      "maxLength": 500
    },
    "locale": {
      "description": "Required. BCP 47 language tag of the human-readable text in the bundle, for example en or zh-TW.",
      "$ref": "#/$defs/bcp47"
    },
    "files": {
      "description": "Required. Every file of the bundle except template.json itself. Exactly one entry each with role agent, harness, policy and acceptance, and at least one entry with role skill. Paths are unique.",
      "type": "array",
      "minItems": 5,
      "items": { "$ref": "#/$defs/file" },
      "allOf": [
        { "contains": { "type": "object", "properties": { "role": { "const": "agent" } }, "required": ["role"] }, "minContains": 1, "maxContains": 1 },
        { "contains": { "type": "object", "properties": { "role": { "const": "harness" } }, "required": ["role"] }, "minContains": 1, "maxContains": 1 },
        { "contains": { "type": "object", "properties": { "role": { "const": "policy" } }, "required": ["role"] }, "minContains": 1, "maxContains": 1 },
        { "contains": { "type": "object", "properties": { "role": { "const": "acceptance" } }, "required": ["role"] }, "minContains": 1, "maxContains": 1 },
        { "contains": { "type": "object", "properties": { "role": { "const": "skill" } }, "required": ["role"] }, "minContains": 1 }
      ]
    },
    "provenance": {
      "description": "Required. Who or what produced the bundle and whether a human reviewed it.",
      "type": "object",
      "additionalProperties": false,
      "required": ["generated_by", "reviewed_by_human", "created"],
      "properties": {
        "generated_by": {
          "description": "Required. The word human, or the name (and version, if known) of the tool that generated the bundle.",
          "type": "string",
          "minLength": 1,
          "maxLength": 200
        },
        "reviewed_by_human": {
          "description": "Required. True if a human reviewed the whole bundle before publication.",
          "type": "boolean"
        },
        "created": {
          "description": "Required. RFC 3339 date-time at which the bundle was created.",
          "type": "string",
          "format": "date-time"
        }
      }
    }
  },
  "$defs": {
    "bcp47": {
      "description": "BCP 47 language tag (simplified syntactic check).",
      "type": "string",
      "pattern": "^[A-Za-z]{2,8}(-[A-Za-z0-9]{1,8})*$"
    },
    "file": {
      "description": "One file of the bundle.",
      "type": "object",
      "additionalProperties": false,
      "required": ["role", "path", "standard", "sha256"],
      "properties": {
        "role": {
          "description": "Required. What the file is: agent (agent.json), harness (harness.json), policy (policy.cedar), acceptance (acceptance.json) or skill (skills/<name>/SKILL.md).",
          "enum": ["agent", "harness", "policy", "acceptance", "skill"]
        },
        "path": {
          "description": "Required. Path relative to the bundle root, using / separators, with no leading /, no empty, . or .. segments.",
          "type": "string",
          "minLength": 1,
          "maxLength": 512,
          "pattern": "^(?!/)(?!.*//)(?!.*/$)(?!(.*/)?\\.{1,2}(/|$))[A-Za-z0-9._/-]+$"
        },
        "standard": {
          "description": "Required. Standard and version the file follows: agentspec@26.3.1 for agent, agent-harness@0.2.0 for harness and acceptance, cedar@4 for policy, agentskills for skill.",
          "type": "string",
          "minLength": 1
        },
        "sha256": {
          "description": "Required. Lowercase hex SHA-256 of the file bytes exactly as stored.",
          "type": "string",
          "pattern": "^[0-9a-f]{64}$"
        }
      },
      "allOf": [
        {
          "if": { "type": "object", "properties": { "role": { "const": "agent" } } },
          "then": { "properties": { "path": { "const": "agent.json" }, "standard": { "const": "agentspec@26.3.1" } } }
        },
        {
          "if": { "type": "object", "properties": { "role": { "const": "harness" } } },
          "then": { "properties": { "path": { "const": "harness.json" }, "standard": { "const": "agent-harness@0.2.0" } } }
        },
        {
          "if": { "type": "object", "properties": { "role": { "const": "policy" } } },
          "then": { "properties": { "path": { "const": "policy.cedar" }, "standard": { "const": "cedar@4" } } }
        },
        {
          "if": { "type": "object", "properties": { "role": { "const": "acceptance" } } },
          "then": { "properties": { "path": { "const": "acceptance.json" }, "standard": { "const": "agent-harness@0.2.0" } } }
        },
        {
          "if": { "type": "object", "properties": { "role": { "const": "skill" } } },
          "then": {
            "properties": {
              "path": { "type": "string", "pattern": "^skills/(?=[a-z0-9-]{1,64}/)[a-z0-9]+(-[a-z0-9]+)*/SKILL\\.md$" },
              "standard": { "const": "agentskills" }
            }
          }
        }
      ]
    }
  }
}
